{
  "profile_id": "cp_example001",
  "profile_version": "1.0.0",
  "created_at": "2026-08-09T10:57:00Z",
  "updated_at": "2026-08-09T10:57:00Z",
  "customer": {
    "name_or_business_name": "Example Customer Ltd.",
    "role_or_title_optional": "Operations Lead",
    "website_optional": "https://example.com"
  },
  "service_requested": "Cybersecurity and AI governance consultation",
  "project_notes_optional": "Customer requested a privacy-first review of website intake language and service workflow. No passwords, secrets, identity documents, or sensitive attributes collected.",
  "contact": {
    "preferred_method": "email",
    "contact_detail": "customer@example.com",
    "best_time_optional": "Weekday afternoons"
  },
  "consent": {
    "notice_version": "customer-profile-notice-v1",
    "notice_presented": true,
    "consent_given": true,
    "consent_timestamp": "2026-08-09T10:57:00Z",
    "consent_method": "web_form_checkbox"
  },
  "retention": {
    "retention_basis": "service_delivery",
    "delete_or_anonymize_after": "2027-08-09",
    "legal_hold": false
  },
  "sharing": {
    "shared_with_third_parties": false,
    "third_party_names_optional": [],
    "sharing_reason_optional": "No third-party sharing required for this example."
  },
  "confirmation": {
    "summary_shown_to_customer": true,
    "customer_confirmed_accuracy": true,
    "confirmed_at": "2026-08-09T10:58:00Z"
  }
}
